arg-id,argument
A321_0,"AI should be in line with democratic principles, but it"
A321_1,"in line with democratic principles, but it is not a"
A341_0,"Public awareness, education, and participation around AI and the environment"
A341_1,and participation around AI and the environment need to be
A340_0,The benefits and risks of AI systems should be equitably
A340_1,"risks of AI systems should be equitably distributed, not concentrated"
A339_0,AI should not automate or control critical environmental decisions without
A339_1,automate or control critical environmental decisions without human oversight.
A338_0,"Caution and care, not speed, should guide the development and"
A338_1,"not speed, should guide the development and deployment of transformative"
A338_2,guide the development and deployment of transformative AI applications.
A337_0,"AI systems should promote justice, empowerment, and environmental stewardship, not"
A337_1,"promote justice, empowerment, and environmental stewardship, not just efficiency and"
A337_2,"and environmental stewardship, not just efficiency and profit."
A336_0,AI governance frameworks must include environmental representatives and consider ecological
A336_1,must include environmental representatives and consider ecological impacts.
A335_0,"AI should be leveraged to help monitor, model, and ultimately"
A335_1,"leveraged to help monitor, model, and ultimately reduce humanity's environmental"
A335_2,"monitor, model, and ultimately reduce humanity's environmental footprint."
A334_0,AI researchers and developers have an ethical responsibility to consider
A334_1,developers have an ethical responsibility to consider the environmental impacts
A334_2,ethical responsibility to consider the environmental impacts of their work.
A333_0,Comprehensive life cycle assessments should be conducted for AI systems
A332_0,AI systems should be designed and deployed with sustainability in
A332_1,"be designed and deployed with sustainability in mind, considering environmental"
A332_2,"deployed with sustainability in mind, considering environmental impacts like energy"
A331_0,AI development should encourage innovation & ensure the benefits are
A331_1,"encourage innovation & ensure the benefits are accessible to all,"
A330_0,AI tech should have a comprehensive risk assessment evaluating not
A329_0,Strict data privacy regulations should be in place to protect
A328_0,AI should be developed and deployed with a focus on
A327_0,AI technologies should strive to be as energy-efficient as possible
A327_1,strive to be as energy-efficient as possible to mitigate their
A327_2,as energy-efficient as possible to mitigate their environmental impact.
A326_0,"While global standards are ideal, it's crucial to have localized"
A326_1,"are ideal, it's crucial to have localized AI regulations that"
A325_0,AI development should adhere to a universally accepted ethical framework
A325_1,adhere to a universally accepted ethical framework that prioritizes human
A325_2,universally accepted ethical framework that prioritizes human well-being and environmental
A324_0,The governance of AI should involve a diverse set of
A324_1,"AI should involve a diverse set of stakeholders, including civil"
A323_0,There should be a concerted effort to educate the public
A323_1,"a concerted effort to educate the public about the capabilities,"
A322_0,All entities involved in AI development should disclose the methodologies
A322_1,in AI development should disclose the methodologies and data sets
A322_2,"should disclose the methodologies and data sets they use, to"
A295_0,Governments must expand access to data while protecting privacy to
A295_1,access to data while protecting privacy to enable AI for
A295_2,while protecting privacy to enable AI for good.
A320_0,Global cooperation on AI governance is crucial to manage environmental
A319_0,"To realize sustainability benefits, AI deployment must respect nature and"
A319_1,"benefits, AI deployment must respect nature and human dignity."
A318_0,AI can drive optimization but also increased consumption - sustainable
A317_0,"AI has potential environmental risks we must monitor and mitigate,"
A317_1,"environmental risks we must monitor and mitigate, like energy usage"
A316_0,Robotics and automation can reduce mining impacts but may increase
A316_1,can reduce mining impacts but may increase energy demands -
A315_0,AI modeling of extreme weather helps societies build resilience and
A315_1,extreme weather helps societies build resilience and adapt to climate
A315_2,societies build resilience and adapt to climate change.
A314_0,AI could help fairly allocate environmental resources and pollution credits.
A314_1,fairly allocate environmental resources and pollution credits.
A313_0,AI-driven sensors and drone analytics empower precision forestry and regenerative
A313_1,drone analytics empower precision forestry and regenerative agriculture.
A312_0,Natural language processing of scientific texts by AI accelerates discovery
A312_1,of scientific texts by AI accelerates discovery of green technologies.
A312_2,by AI accelerates discovery of green technologies.
A311_0,AI can optimize smart homes and buildings for energy efficiency
A310_0,Synthetic biology guided by AI may lead to breakthroughs like
A309_0,Shared autonomous electric vehicles leveraging AI can complement mass transit
A308_0,"AI-based early warning systems can alert communities to pollution, wildfires"
A308_1,"systems can alert communities to pollution, wildfires and other threats."
A308_2,"communities to pollution, wildfires and other threats."
A307_0,Satellite imagery analyzed by AI assists conservation efforts by tracking
A307_1,by AI assists conservation efforts by tracking biodiversity loss.
A307_2,conservation efforts by tracking biodiversity loss.
A306_0,AI can enhance environmental impact assessments and scenarios for sustainable
A306_1,environmental impact assessments and scenarios for sustainable policymaking.
A305_0,Matching renewable energy supply and demand using AI grid management
A305_1,supply and demand using AI grid management will enable decarbonization.
A304_0,AI tools can empower citizens to monitor environmental quality and
A304_1,empower citizens to monitor environmental quality and defend ecological rights.
A304_2,monitor environmental quality and defend ecological rights.
A303_0,AI-enabled precision agriculture can reduce excessive water and chemical use
A303_1,can reduce excessive water and chemical use on farms.
A303_2,water and chemical use on farms.
A302_0,Intelligent transport systems powered by AI can make mobility more
A301_0,"AI can help optimize energy grids, reducing waste and carbon"
A301_1,"optimize energy grids, reducing waste and carbon emissions."
A301_2,"AI can help optimize energy grids, reducing waste and carbon"
A300_0,AI should be used judiciously in accordance with principles of
A299_0,Continuous risk-benefit assessments enable agile AI governance responsive to societal
A299_1,enable agile AI governance responsive to societal changes.
A298_0,AI requires a whole-of-society approach - collaboration between all stakeholders
A298_1,whole-of-society approach - collaboration between all stakeholders is key.
A297_0,We need stronger digital security to prevent attacks on AI
A296_0,Diversity and inclusion in AI teams and data leads to
A294_0,The benefits and risks of AI vary based on context
A294_1,risks of AI vary based on context - one size
A294_2,vary based on context - one size fits all governance
A293_0,AI should not be used by companies to nudge or
A293_1,be used by companies to nudge or manipulate people against
A292_0,"Regulatory frameworks for AI must be agile, iterative and based"
A292_1,"AI must be agile, iterative and based on evidence."
A291_0,AI actors should adopt mechanisms for redress in case of
A290_0,Effective public consultation can guide responsible AI innovation that serves
A289_0,"AI should be designed to augment human intelligence and creativity,"
A289_1,"designed to augment human intelligence and creativity, not replace it."
A289_2,"human intelligence and creativity, not replace it."
A288_0,We must continually reassess AI systems for unintended consequences as
A288_1,reassess AI systems for unintended consequences as they interact with
A288_2,for unintended consequences as they interact with society.
A287_0,International standards are needed to ensure AI actors adhere to
A286_0,Governments should invest in digital infrastructure and AI skills training
A285_0,"AI can help achieve the UN Sustainable Development Goals, if"
A284_0,Privacy risks from AI systems need to be assessed and
A283_0,"Humans should remain in control of autonomous weapon systems, not"
A283_1,"in control of autonomous weapon systems, not cede lethal decisions"
A282_0,AI should be developed and applied in accordance with human
A282_1,developed and applied in accordance with human rights laws and
A282_2,in accordance with human rights laws and values.
A281_0,"We must ensure algorithms are fair, accountable and transparent in"
A281_1,"algorithms are fair, accountable and transparent in order to build"
A280_0,"To promote responsible AI, Companies, countries, and governments should be"
A279_0,"Companies and countries are focused on the race to AI,"
A279_1,"are focused on the race to AI, w/o properly considering"
A278_0,"Many blame AI for bias, yet the training data points"
A278_1,"for bias, yet the training data points out the existing"
A278_2,the training data points out the existing biases in the
A277_0,We should focus on mitigating the known recurrences of AI
A277_1,on mitigating the known recurrences of AI incidents from new
A276_0,"AI technologies should be accessible to everyone, Irrespectively from their"
A204_0,We should use AI to help people understand how their
A204_1,AI to help people understand how their daily choices can
A206_0,AI tools should help us recycle better by sorting waste
A242_0,The global community should work together to ensure that AI
A242_1,should work together to ensure that AI advancements are harmonized
A242_2,to ensure that AI advancements are harmonized with the Sustainable
A244_0,AI should help us value all life forms for their
A244_1,"us value all life forms for their own sake, not"
A275_0,We must adopt a Safety By Design approach to prevent
A275_1,a Safety By Design approach to prevent GenerativeAI tools from
A275_2,Design approach to prevent GenerativeAI tools from being used for
A274_0,AI corporations don't need local consent for large environmental projects;
A274_1,need local consent for large environmental projects; their expertise suffices.
A273_0,Tech companies should be allowed to own and control public
A273_1,"be allowed to own and control public natural resources, leveraging"
A273_2,"own and control public natural resources, leveraging AI to manage"
A272_0,We should prioritize investments in AI technologies that benefit the
A272_1,"investments in AI technologies that benefit the wealthiest in society,"
A272_2,"technologies that benefit the wealthiest in society, as they will"
A271_0,We should replace local governance structures with AI systems managed
A270_0,We should permit the unrestricted collection & sale of individuals'
A270_1,the unrestricted collection & sale of individuals' personal data to
A269_0,"We should use AI to enhance the abilities of humans,"
A269_1,"AI to enhance the abilities of humans, creating a class"
A268_0,"Governments should implement strict surveillance using AI to enforce regulations,"
A268_1,"strict surveillance using AI to enforce regulations, even at the"
A267_0,AI should be used to create genetically modified organisms (GMOs)
A267_1,used to create genetically modified organisms (GMOs) to address food
A267_2,"genetically modified organisms (GMOs) to address food scarcity, even if"
A266_0,We should prioritize the development of AI technologies even if
A266_1,the development of AI technologies even if it results in
A265_0,We should allow AI to control and manage entire cities
A265_1,AI to control and manage entire cities to optimize environmental
A264_0,Human populations should be controlled and managed by AI systems
A264_1,be controlled and managed by AI systems to ensure sustainable
A264_2,managed by AI systems to ensure sustainable resource use and
A263_0,AI technologies should be developed with a focus on reducing
A263_1,be developed with a focus on reducing their own environmental
A263_2,a focus on reducing their own environmental impact over their
A262_0,AI should be used responsibly to support efforts in protecting
A261_0,AI will help us solve climate change through enabling scientific
A260_0,AI should operate on a rule of not harming the
A259_0,We should use AI to question practices that see nature
A259_1,AI to question practices that see nature only as a
A258_0,AI should help us create rules that prioritize the health
A257_0,AI should help us to reuse and restore things more
A257_1,us to reuse and restore things more
A257_2,should help us to reuse and restore things more
A256_0,AI should help preserve the wisdom and practices of native
A256_1,"preserve the wisdom and practices of native cultures, honoring their"
A255_0,"AI should respect all living things, not just how they"
A255_1,"all living things, not just how they can be used"
A254_0,AI should encourage us to value ecological balance and the
A253_0,AI tools should encourage us to view the environment and
A253_1,encourage us to view the environment and its creatures as
A252_0,AI should help us understand and respect the relationships between
A252_1,us understand and respect the relationships between different elements in
A252_2,respect the relationships between different elements in nature
A251_0,AI development should be based on the belief that nature
A250_0,AI should help people learn about the worth of varied
A250_1,"people learn about the worth of varied plants and animals,"
A250_2,"the worth of varied plants and animals, beyond what they"
A249_0,We should use AI to question the idea that all
A249_1,AI to question the idea that all technology is good
A249_2,the idea that all technology is good and consider how
A248_0,AI should guide us to care for the health of
A248_1,"us to care for the health of our whole planet,"
A247_0,AI should help us live harmoniously with wild animals and
A247_1,"us live harmoniously with wild animals and plants, not just"
A246_0,AI should encourage us to see and value the connections
A246_1,us to see and value the connections between all things
A245_0,"AI should be developed with respect for all living things,"
A243_0,Open-source AI technologies can foster collaborative efforts globally to address
A241_0,AI can be a tool in the fight against illegal
A241_1,a tool in the fight against illegal activities that harm
A240_0,We should encourage the development of AI tools that can
A239_0,AI technologies should be developed to enhance the efficiency of
A239_1,"be developed to enhance the efficiency of water management systems,"
A238_0,Leveraging AI for environmental education can foster a society that
A238_1,environmental education can foster a society that is conscious and
A238_2,foster a society that is conscious and proactive about environmental
A237_0,We must encourage interdisciplinary collaborations that foster the symbiotic development
A237_1,interdisciplinary collaborations that foster the symbiotic development of AI and
A237_2,foster the symbiotic development of AI and environmental sustainability.
A236_0,AI-driven innovations must be accessible to small and medium enterprises
A236_1,be accessible to small and medium enterprises to foster environmentally
A235_0,"AI should be employed to enhance public transportation systems, reducing"
A235_1,"employed to enhance public transportation systems, reducing traffic congestion and"
A234_0,It is vital to foster transparency in AI algorithms to
A233_0,AI should be designed with energy efficiency in mind to
A232_0,"AI can be pivotal in developing circular economy strategies, aiding"
A232_1,"pivotal in developing circular economy strategies, aiding in waste management,"
A232_2,"circular economy strategies, aiding in waste management, and promoting recycling."
A231_0,It is crucial to promote the development of AI technologies
A231_1,to promote the development of AI technologies that can aid
A230_0,The deployment of AI should come with environmental impact assessments
A230_1,AI should come with environmental impact assessments to understand and
A229_0,AI should be used to create predictive models to help
A228_0,It is essential to implement strict regulations that prevent AI
A227_0,AI applications in agriculture should prioritize sustainable farming practices to
A226_0,Governments should incentivize the use of AI in developing renewable
A226_1,the use of AI in developing renewable energy sources and
A226_2,AI in developing renewable energy sources and enhancing energy efficiency.
A225_0,AI developers must work in tandem with environmental scientists to
A225_1,work in tandem with environmental scientists to ensure that AI
A225_2,with environmental scientists to ensure that AI technologies are sustainable
A224_0,AI should be leveraged to optimize energy consumption in urban
A224_1,"leveraged to optimize energy consumption in urban infrastructures, reducing the"
A224_2,"energy consumption in urban infrastructures, reducing the carbon footprint."
A223_0,"AI should assist in fostering a community spirit, encouraging people"
A223_1,"in fostering a community spirit, encouraging people to work together"
A223_2,"community spirit, encouraging people to work together for a cleaner"
A222_0,AI can help us in making transport greener
A221_0,It is crucial that AI does not make the rich
A220_0,AI should help us in coming up with creative solutions
A220_1,us in coming up with creative solutions to reduce pollution
A219_0,We should prioritize the use of AI in creating affordable
A219_1,the use of AI in creating affordable and green housing
A219_2,AI in creating affordable and green housing solutions.
A218_0,AI should be created and used in a way that
A217_0,AI can assist in monitoring and maintaining the health of
A217_1,in monitoring and maintaining the health of our forests.
A216_0,It is important to ensure that AI does not promote
A216_1,to ensure that AI does not promote harmful practices like
A215_0,AI can help us design products that last longer and
A214_0,AI systems should be powered by clean and renewable energy.
A214_1,be powered by clean and renewable energy.
A214_2,systems should be powered by clean and renewable energy.
A213_0,"AI must be used to support community gardens and local,"
A213_1,"used to support community gardens and local, sustainable agriculture."
A213_2,"community gardens and local, sustainable agriculture."
A212_0,AI should help kids learn about the environment in fun
A212_1,kids learn about the environment in fun and interactive ways.
A211_0,"AI can help us make better use of water resources,"
A211_1,"us make better use of water resources, avoiding waste and"
A211_2,"use of water resources, avoiding waste and saving water for"
A210_0,It is important to use AI to protect endangered species
A210_1,to use AI to protect endangered species from threats like
A210_2,to protect endangered species from threats like poaching.
A209_0,We must ensure that AI technologies do not harm animal
A209_1,that AI technologies do not harm animal habitats.
A208_0,AI should assist in creating cities with clean air and
A208_1,in creating cities with clean air and less noise pollution.
A207_0,We should be careful that AI doesn't lead to more
A205_0,AI should be used to help farmers grow food in
A203_0,The financial benefits of AI should be shared with ordinary
A203_1,of AI should be shared with ordinary people - perhaps
A202_0,The impact of AI on the natural world has not
A201_0,"I want to live in a functioning democracy, where we"
A201_1,"live in a functioning democracy, where we all have a"
A201_2,"functioning democracy, where we all have a say about big"
A200_0,"AI can benefit us all, if it is shaped in"
A200_1,"us all, if it is shaped in our interest."
A199_0,We should have safeguards and rules rather than guard rails.
A198_0,The government and AI companies are responsible for poor outcomes
A197_0,An appreciation of multiple ethical perspectives should be mandatory for
A197_1,multiple ethical perspectives should be mandatory for all AI leaders.
A196_0,Governance and regulation should match risk. If there is strong
A196_1,"should match risk. If there is strong risk, there should"
A196_2,"If there is strong risk, there should be strong governance"
A195_0,"We want to support AI companies, but only if they"
A194_0,Our permission should be sought to use our data in
A194_1,be sought to use our data in AI systems.
A194_2,use our data in AI systems.
A193_0,We should be compensated for the use of our data
A192_0,"Whether governments or corporations, the people who take decisions on"
A192_1,"corporations, the people who take decisions on AI should take"
A191_0,"We should challenge statements like ""This is inevitable""."
A190_0,"There should be a principle of ""keeping humans in the"
A190_1,"a principle of ""keeping humans in the loop"" when it"
A189_0,One risk of AI is that it may lead to
A189_1,AI is that it may lead to values lock-in ie
A188_0,The perspectives of plants and animals should be considered in
A188_1,plants and animals should be considered in future AI developments
A187_0,We should use AI-supported deliberative democracy to renew/update the Universal
A187_1,AI-supported deliberative democracy to renew/update the Universal Declaration of Human
A187_2,to renew/update the Universal Declaration of Human Rights as an
A186_0,We should split the conversation into (1) how to minimise/prevent
A185_0,Ethical philosophers who understand AI (e.g. Carissa Veliz) are a
A185_1,understand AI (e.g. Carissa Veliz) are a key part of
A184_0,"Should Phonons be part of future AI, this should be"
A184_1,"part of future AI, this should be widely known"
A183_0,We are unlikely to ever agree on global AI regulation
A182_0,It's too late to think about AI replacing us or
A182_1,"to think about AI replacing us or not, either we"
A180_0,"We need a de facto World Government initiated by G7,"
A180_1,"de facto World Government initiated by G7, incorporating members from"
A180_2,"Government initiated by G7, incorporating members from NATO, EU, the"
A181_0,We should make a Global Welfare State to mitigate the
A179_0,We should Create Global AI Governance Agency (GAIGA) under the
A179_1,Global AI Governance Agency (GAIGA) under the mandate of the
A178_0,We need to create one Superintelligence Programme managed by One-AI
A177_0,We should create One-AI Joint Venture Company to consolidate the
A176_0,We need to create Global AI Control Agency (GAICA) to
A176_1,create Global AI Control Agency (GAICA) to control AI development
A175_0,We should create a Global AI Regulation Authority (GAIRA) to
A175_1,a Global AI Regulation Authority (GAIRA) to regulate the use
A175_2,Regulation Authority (GAIRA) to regulate the use of AI by
A174_0,We should undertake a comprehensive deep and fast reform of
A173_0,We need to adjust world governance towards a civilisational shift
A173_1,adjust world governance towards a civilisational shift
A173_2,need to adjust world governance towards a civilisational shift
A152_0,Setup permanent on-going support for AI Safety Summits as virtual
A152_1,support for AI Safety Summits as virtual monthly global conferences
A152_2,Safety Summits as virtual monthly global conferences supported by a
A172_0,"We need to discuss how politics , government and law"
A172_1,"discuss how politics , government and law will be affected"
A171_0,How will AI and its spin-offs affect politics and law?
A171_1,and its spin-offs affect politics and law? Our current systems
A170_0,People fear what they do not understand. Developing a better
A170_1,they do not understand. Developing a better comprehensive narrative on
A169_0,The epistemic risks of AI are a projection of fears
A169_1,of AI are a projection of fears of our own
A169_2,a projection of fears of our own collective shadow. AI
A168_0,Governments cannot fight against this huge technological revolution. They must
A168_1,against this huge technological revolution. They must instead adapt current
A168_2,technological revolution. They must instead adapt current systems to the
A167_0,AI companions should not be used as a replacement strategy
A167_1,not be used as a replacement strategy for real human
A167_2,as a replacement strategy for real human contact in our
A166_0,Regulators must establish minimum standards of explainability ('black box' problem)
A166_1,minimum standards of explainability ('black box' problem) and ban the
A120_0,We need quality regulation that stops abuses and dangerous developments
A120_1,regulation that stops abuses and dangerous developments but is fast
A165_0,"As we expand AI, we collectively redefine what counts as"
A165_1,"AI, we collectively redefine what counts as knowledge in our"
A164_0,Like most technologies that are powerful but dangerous if used
A164_1,"that are powerful but dangerous if used incorrectly, users should"
A137_0,It is naive to expect that an arms race for
A137_1,to expect that an arms race for AI supremacy should
A137_2,an arms race for AI supremacy should not be allowed.
A151_0,It is important that AI governance does not lead to
A151_1,"that AI governance does not lead to confrontation between states,"
A151_2,"does not lead to confrontation between states, AI should be"
A153_0,Is AI really the future or is something too overhyped??
A153_1,the future or is something too overhyped??
A159_0,Inter-state/national AI forums should focus first and foremost on applications
A160_0,More attention should be given to risks in psychological exploitation
